{"actor":{"id":"imperator-development-root","kind":"imperator"},"attestation_id":"studium.chancellor.approved.1","contract_version":"1.0.0","correlation_id":"studium-canonical-chancellor-lifecycle","issued_at":"2026-08-13T00:00:00-04:00","profile_ref":{"content_digest":"sha256:82b319d973af1844b63f46987b8dfb6180591d92d55ee2e918a5f59df80713be","profile_id":"studium.chancellor","profile_version":"1.0.0"},"reason":"Canonical chancellor Profile approved for development runtime","record_digest":"sha256:8b30eb3f8a533d8e2ae39fc44edd5bf367013209e6e90fb07bbe4b04eae3ae1d","transition":{"to":"approved"}}
