{"actor":{"id":"curia.secretary","kind":"seat"},"attestation_id":"curia.secretary.current_active.1","contract_version":"1.0.0","correlation_id":"primordial-secretary-lifecycle","issued_at":"2026-08-08T00:00:00-04:00","profile_ref":{"content_digest":"sha256:80b3da619e21278f11b6926f64dec366ee937d2e5d35b5b2b3a4574ac5ac6f02","profile_id":"curia.secretary","profile_version":"1.0.0"},"reason":"Primordial development composition","record_digest":"sha256:5b12ffcf4b5d22f77b55d9a45f0e878b7f991d5895ae7cc944d7d94765c2ab54","transition":{"from":"approved","prior_attestation_id":"curia.secretary.approved.1","to":"current_active"}}
