{"actor":{"id":"imperator-development-root","kind":"imperator"},"attestation_id":"foundry.artificer.approved.1","contract_version":"1.0.0","correlation_id":"foundry-canonical-artificer-lifecycle","issued_at":"2026-08-12T00:00:00-04:00","profile_ref":{"content_digest":"sha256:113e6d82ae6c03aff7d304d11017a3e519ebdeb86bfa8c69bea707ace5a2db25","profile_id":"foundry.artificer","profile_version":"1.0.0"},"reason":"Canonical Artificer Profile approved for development runtime","record_digest":"sha256:3203ff81c6a3bde9878ce5a91ad9491f29771aa1021222448ca6abe796832296","transition":{"to":"approved"}}
