{"actor":{"id":"foundry.profile-registry","kind":"office_mechanic"},"attestation_id":"foundry.artificer.current_active.1","contract_version":"1.0.0","correlation_id":"foundry-canonical-artificer-lifecycle","issued_at":"2026-08-12T00:00:00-04:00","profile_ref":{"content_digest":"sha256:113e6d82ae6c03aff7d304d11017a3e519ebdeb86bfa8c69bea707ace5a2db25","profile_id":"foundry.artificer","profile_version":"1.0.0"},"reason":"Canonical approved Artificer Profile designated current and active","record_digest":"sha256:686b0d132e2285ae528b84069d707e75794b6623d86e655ff9228f2efabe27a7","transition":{"from":"approved","prior_attestation_id":"foundry.artificer.approved.1","to":"current_active"}}
