{"actor":{"id":"curia.chamberlain","kind":"seat"},"attestation_id":"curia.chamberlain.current_active.1","contract_version":"1.0.0","correlation_id":"primordial-chamberlain-lifecycle","issued_at":"2026-08-08T00:00:00-04:00","profile_ref":{"content_digest":"sha256:38b75b4f472f80c055d53c7379f93afc35802a56f335341d1337103341e5e704","profile_id":"curia.chamberlain","profile_version":"1.0.0"},"reason":"Primordial development composition","record_digest":"sha256:c49fe59757562d033e8915117da290e77eed78a03f09005a739d18c6654d1857","transition":{"from":"approved","prior_attestation_id":"curia.chamberlain.approved.1","to":"current_active"}}
