{"actor":{"id":"imperator-development-root","kind":"imperator"},"attestation_id":"curia.chamberlain.approved.1","contract_version":"1.0.0","correlation_id":"primordial-chamberlain-lifecycle","issued_at":"2026-08-08T00:00:00-04:00","profile_ref":{"content_digest":"sha256:38b75b4f472f80c055d53c7379f93afc35802a56f335341d1337103341e5e704","profile_id":"curia.chamberlain","profile_version":"1.0.0"},"reason":"Primordial development composition","record_digest":"sha256:e59889872456fe4e15d1d1c89da548ce139698168f04a0c295c28064a1be4d62","transition":{"to":"approved"}}
