{"actor":{"id":"imperator-development-root","kind":"imperator"},"attestation_id":"conscription.recruiter.provisional.approved.1","contract_version":"1.0.0","correlation_id":"primordial-provisional-recruiter-lifecycle","issued_at":"2026-08-08T00:00:00-04:00","profile_ref":{"content_digest":"sha256:1cc7b334f852b5afb3378e176d4e22682d3857f8f5960bdac8e0ebaac8711b3c","profile_id":"conscription.recruiter.provisional","profile_version":"1.0.0"},"reason":"Primordial development composition","record_digest":"sha256:757f481f0bfecbcd0e8e6cd06a3c80ea02e9370f806f42e7dc090108071e9b32","transition":{"to":"approved"}}
