{"actor":{"id":"imperator-development-root","kind":"imperator"},"attestation_id":"guildhall.committee.boundary-challenge.approved.1","contract_version":"1.0.0","correlation_id":"guildhall-canonical-committee-boundary-challenge-lifecycle","examination_disposition_id":"guildhall-canonical-committee-boundary-challenge-examination-favorable-1","issued_at":"2026-08-11T00:00:00-04:00","profile_ref":{"content_digest":"sha256:56aad60739f71682b9a81677080de3a32c6dff45194ed8f27b42e142430fcd95","profile_id":"guildhall.committee.boundary-challenge","profile_version":"1.0.0"},"reason":"Canonical Guildhall staff Profile approved for development runtime","record_digest":"sha256:a448ebac5aee9600c8c5da297436a7901d04101e53593256a4665aaa495a402a","transition":{"to":"approved"}}
