{"actor":{"id":"guildhall.profile-registry","kind":"office_mechanic"},"attestation_id":"guildhall.committee.boundary-challenge.current_active.1","contract_version":"1.0.0","correlation_id":"guildhall-canonical-committee-boundary-challenge-lifecycle","issued_at":"2026-08-11T00:00:00-04:00","profile_ref":{"content_digest":"sha256:56aad60739f71682b9a81677080de3a32c6dff45194ed8f27b42e142430fcd95","profile_id":"guildhall.committee.boundary-challenge","profile_version":"1.0.0"},"reason":"Canonical approved Guildhall staff Profile designated current and active","record_digest":"sha256:5d3b9449928c8878c2f788998ef972363d720cff227fc79afb6b85ba6ee5e61f","transition":{"from":"approved","prior_attestation_id":"guildhall.committee.boundary-challenge.approved.1","to":"current_active"}}
