{"actor":{"id":"imperator-development-root","kind":"imperator"},"attestation_id":"guildhall.committee.composition.approved.1","contract_version":"1.0.0","correlation_id":"guildhall-canonical-committee-composition-lifecycle","examination_disposition_id":"guildhall-canonical-committee-composition-examination-favorable-1","issued_at":"2026-08-11T00:00:00-04:00","profile_ref":{"content_digest":"sha256:188fdcf828be6d719afa7e8153ea875df429853f288e917317af593ee41d85fa","profile_id":"guildhall.committee.composition","profile_version":"1.0.0"},"reason":"Canonical Guildhall staff Profile approved for development runtime","record_digest":"sha256:68f7b3a13f56685f31794f7ec9a2f1d67387e390bd025ab10a8b2e765bcd6b1a","transition":{"to":"approved"}}
