{"actor":{"id":"imperator-development-root","kind":"imperator"},"attestation_id":"conscription.recruiter.ordinary.approved.1","contract_version":"1.0.0","correlation_id":"primordial-ordinary-recruiter-lifecycle","issued_at":"2026-08-08T00:00:00-04:00","profile_ref":{"content_digest":"sha256:fccda704969443d1d94cba09e9c5d835ee33e444cb3d5ef9803115e20f3f7b0f","profile_id":"conscription.recruiter.ordinary","profile_version":"1.0.0"},"reason":"Primordial development composition","record_digest":"sha256:7074f2e61fe5c7acefe0a7e00afbd3bd3b8c67e05688cf360834d4e7dcec3dc0","transition":{"to":"approved"}}
