{"actor":{"id":"castellan.rector","kind":"seat"},"attestation_id":"castellan.rector.current_active.1","contract_version":"1.0.0","correlation_id":"primordial-rector-lifecycle","issued_at":"2026-08-08T00:00:00-04:00","profile_ref":{"content_digest":"sha256:8b0588cfe17b1c830ca6dfbbfb2e1dae691710b0871a07fb6ab6a54803a30bf6","profile_id":"castellan.rector","profile_version":"1.0.0"},"reason":"Primordial development composition","record_digest":"sha256:f055f90b57dfdf9bc77a75111b9cf865ff9370cd1bd34a6d6a83ec31736183c4","transition":{"from":"approved","prior_attestation_id":"castellan.rector.approved.1","to":"current_active"}}
