{"actor":{"id":"imperator-development-root","kind":"imperator"},"attestation_id":"guildhall.committee.disciplinary-fit.approved.1","contract_version":"1.0.0","correlation_id":"guildhall-canonical-committee-disciplinary-fit-lifecycle","examination_disposition_id":"guildhall-canonical-committee-disciplinary-fit-examination-favorable-1","issued_at":"2026-08-11T00:00:00-04:00","profile_ref":{"content_digest":"sha256:96f50f773fd0454f5b3929939caa723c4e14263d18172e14b1e4003e26b09059","profile_id":"guildhall.committee.disciplinary-fit","profile_version":"1.0.0"},"reason":"Canonical Guildhall staff Profile approved for development runtime","record_digest":"sha256:67e576e71c1b493b97531971c6523557ff21da33657b9f9c0910f9716ebcb052","transition":{"to":"approved"}}
