{"actor":{"id":"imperator-development-root","kind":"imperator"},"attestation_id":"curia.secretary.approved.1","contract_version":"1.0.0","correlation_id":"primordial-secretary-lifecycle","issued_at":"2026-08-08T00:00:00-04:00","profile_ref":{"content_digest":"sha256:80b3da619e21278f11b6926f64dec366ee937d2e5d35b5b2b3a4574ac5ac6f02","profile_id":"curia.secretary","profile_version":"1.0.0"},"reason":"Primordial development composition","record_digest":"sha256:d0c9c6a02b2116b0c703eb56764327b5f09283bbc01dfedfa6a8769c2128e35f","transition":{"to":"approved"}}
