{"actor":{"id":"guildhall.profile-registry","kind":"office_mechanic"},"attestation_id":"guildhall.committee.composition.current_active.1","contract_version":"1.0.0","correlation_id":"guildhall-canonical-committee-composition-lifecycle","issued_at":"2026-08-11T00:00:00-04:00","profile_ref":{"content_digest":"sha256:188fdcf828be6d719afa7e8153ea875df429853f288e917317af593ee41d85fa","profile_id":"guildhall.committee.composition","profile_version":"1.0.0"},"reason":"Canonical approved Guildhall staff Profile designated current and active","record_digest":"sha256:d382d2ba5ef9dc5a648aabcce7536a141477984974dbbacb8286f713ef1f6a3d","transition":{"from":"approved","prior_attestation_id":"guildhall.committee.composition.approved.1","to":"current_active"}}
