{"actor":{"id":"guildhall.profile-registry","kind":"office_mechanic"},"attestation_id":"guildhall.committee.disciplinary-fit.current_active.1","contract_version":"1.0.0","correlation_id":"guildhall-canonical-committee-disciplinary-fit-lifecycle","issued_at":"2026-08-11T00:00:00-04:00","profile_ref":{"content_digest":"sha256:96f50f773fd0454f5b3929939caa723c4e14263d18172e14b1e4003e26b09059","profile_id":"guildhall.committee.disciplinary-fit","profile_version":"1.0.0"},"reason":"Canonical approved Guildhall staff Profile designated current and active","record_digest":"sha256:1c6f80deb1f6172d931e1d4cb385bdc42261e7c931c5c1d4fd9fa9b71a1dba4a","transition":{"from":"approved","prior_attestation_id":"guildhall.committee.disciplinary-fit.approved.1","to":"current_active"}}
