{"actor":{"id":"imperator-development-root","kind":"imperator"},"attestation_id":"curia.seneschal.approved.1","contract_version":"1.0.0","correlation_id":"primordial-seneschal-lifecycle","issued_at":"2026-08-08T00:00:00-04:00","profile_ref":{"content_digest":"sha256:29382f84517536ef02eff3602a3cee77ca7b524ae6aebe355b938ca4ddf973aa","profile_id":"curia.seneschal","profile_version":"1.0.0"},"reason":"Primordial development composition","record_digest":"sha256:b8dd2fa1afb45f9938eb13a402f468bfc4db38b501f57b1f1b272d75ad58e19e","transition":{"to":"approved"}}
