{"actor":{"id":"hagiography.profile-registry","kind":"office_mechanic"},"attestation_id":"hagiography.sanctographer.current_active.1","contract_version":"1.0.0","correlation_id":"hagiography-canonical-sanctographer-lifecycle","issued_at":"2026-08-13T00:00:00-04:00","profile_ref":{"content_digest":"sha256:fc07bde14ab0383409a2adf4dc855a6652d3141b30037b190aa00a6afe49933c","profile_id":"hagiography.sanctographer","profile_version":"1.0.0"},"reason":"Canonical approved sanctographer Profile designated current and active","record_digest":"sha256:333152ce3204f9498d80184171de2843c8928b45e55a8e20fc871c609cfb9b7d","transition":{"from":"approved","prior_attestation_id":"hagiography.sanctographer.approved.1","to":"current_active"}}
