{"actor":{"id":"imperator-development-root","kind":"imperator"},"attestation_id":"hagiography.sanctographer.approved.1","contract_version":"1.0.0","correlation_id":"hagiography-canonical-sanctographer-lifecycle","issued_at":"2026-08-13T00:00:00-04:00","profile_ref":{"content_digest":"sha256:fc07bde14ab0383409a2adf4dc855a6652d3141b30037b190aa00a6afe49933c","profile_id":"hagiography.sanctographer","profile_version":"1.0.0"},"reason":"Canonical sanctographer Profile approved for development runtime","record_digest":"sha256:a1eec2484370abc00bcfd310fb1e4ef47e8c0c285838d074f7d418078bb64ea4","transition":{"to":"approved"}}
