{"actor":{"id":"guildhall.profile-registry","kind":"office_mechanic"},"attestation_id":"guildhall.guildmaster.current_active.1","contract_version":"1.0.0","correlation_id":"guildhall-canonical-guildmaster-lifecycle","issued_at":"2026-08-11T00:00:00-04:00","profile_ref":{"content_digest":"sha256:431e5dab7dea2022bdb30e7ce4c8231b1ab39d2b371cc40163ecba18be88e58b","profile_id":"guildhall.guildmaster","profile_version":"1.0.0"},"reason":"Canonical approved Guildhall staff Profile designated current and active","record_digest":"sha256:ed7bb17bcf675832c5c8af7fd6271302507025d7dafd4ed065ed4f949b36fae7","transition":{"from":"approved","prior_attestation_id":"guildhall.guildmaster.approved.1","to":"current_active"}}
