{"actor":{"id":"imperator-development-root","kind":"imperator"},"attestation_id":"castellan.rector.approved.1","contract_version":"1.0.0","correlation_id":"primordial-rector-lifecycle","issued_at":"2026-08-08T00:00:00-04:00","profile_ref":{"content_digest":"sha256:8b0588cfe17b1c830ca6dfbbfb2e1dae691710b0871a07fb6ab6a54803a30bf6","profile_id":"castellan.rector","profile_version":"1.0.0"},"reason":"Primordial development composition","record_digest":"sha256:6ef71fc0ead016c056c483d1221fcbd4c616bb03386b28d7607630df270efea6","transition":{"to":"approved"}}
