{"actor":{"id":"studium.profile-registry","kind":"office_mechanic"},"attestation_id":"studium.chancellor.current_active.1","contract_version":"1.0.0","correlation_id":"studium-canonical-chancellor-lifecycle","issued_at":"2026-08-13T00:00:00-04:00","profile_ref":{"content_digest":"sha256:82b319d973af1844b63f46987b8dfb6180591d92d55ee2e918a5f59df80713be","profile_id":"studium.chancellor","profile_version":"1.0.0"},"reason":"Canonical approved chancellor Profile designated current and active","record_digest":"sha256:05ae3dcf64d8cd4f74615393aacc4542bffc65dbc45a66cf1a194e2c236618db","transition":{"from":"approved","prior_attestation_id":"studium.chancellor.approved.1","to":"current_active"}}
