{"actor":{"id":"conscription.recruiter","kind":"seat"},"attestation_id":"conscription.recruiter.provisional.current_active.1","contract_version":"1.0.0","correlation_id":"primordial-provisional-recruiter-lifecycle","issued_at":"2026-08-08T00:00:00-04:00","profile_ref":{"content_digest":"sha256:1cc7b334f852b5afb3378e176d4e22682d3857f8f5960bdac8e0ebaac8711b3c","profile_id":"conscription.recruiter.provisional","profile_version":"1.0.0"},"reason":"Primordial development composition","record_digest":"sha256:67cf3360de51ec4fabfd3573bb4300c0b1bd8409a440a4e23edeefa1ade5f28b","transition":{"from":"approved","prior_attestation_id":"conscription.recruiter.provisional.approved.1","to":"current_active"}}
