{"actor":{"id":"curia.seneschal","kind":"seat"},"attestation_id":"curia.seneschal.current_active.1","contract_version":"1.0.0","correlation_id":"primordial-seneschal-lifecycle","issued_at":"2026-08-08T00:00:00-04:00","profile_ref":{"content_digest":"sha256:29382f84517536ef02eff3602a3cee77ca7b524ae6aebe355b938ca4ddf973aa","profile_id":"curia.seneschal","profile_version":"1.0.0"},"reason":"Primordial development composition","record_digest":"sha256:eaf7d03d6bed026576e8c06ddd90cc7104306a91e2198f77f10b59dd8b2313a7","transition":{"from":"approved","prior_attestation_id":"curia.seneschal.approved.1","to":"current_active"}}
